2;Blur;2nd level Illusion;1 action;Self;V;Concentration, up to 1 minute;Your body becomes blurred, shifting and wavering to all who can see you. For the duration, any creature has disadvantage on attack rolls against you. An attacker is immune to this effect if it doesn't rely on sight, as with blindsight, or can see through illusions, as with truesight.;Artificer;Artificer
2;Continual Flame;2nd level Evocation;1 action;Touch;V, S, M;Until dispelled;(ruby dust worth 50 gp, which the spell consumes)A flame, equivalent in brightness to a torch, springs forth from an object that you touch. The effect looks like a regular flame, but it creates no heat and doesn't use oxygen. A <i>continual flame</i> can be covered or hidden but not smothered or quenched.;Artificer;Artificer
2;Darkvision;2nd level Transmutation;1 action;Touch;V, S, M;8 hours;(either a pinch of dried carrot or an agate)You touch a willing creature to grant it the ability to see in the dark. For the duration, that creature has darkvision out to a range of 60 feet.;Artificer;Artificer
2;Enhance Ability;2nd level Transmutation;1 action;Touch;V, S, M;Concentration, up to 1 hour;(fur or a feather from a beast)You touch a creature and bestow upon it a magical enhancement. Choose one of the following effects - the target gains the effect until the spell ends.<br> <b>Bear's Endurance</b>: The target has advantage on Constitution checks. It also gains 2d6 temporary hit points, which are lost when the spell ends.<br> <b>Bull's Strength</b>: The target has advantage on Strength checks, and his or her carrying capacity doubles.<br> <b>Cat's Grace</b>: The target has advantage on Dexterity checks. It also doesn't take damage from falling 20 feet or less if it isn't incapacitated.<br> <b>Eagle's Splendor</b>: The target has advantage on Charisma checks.<br> <b>Fox's Cunning</b>: The target has advantage on Intelligence checks.<br> <b>Owl's Wisdom</b>: The target has advantage on Wisdom checks.<br> <b>At Higher Levels</b>: When you cast this spell using a spell slot of 3rd level or higher, you can target one additional creature for each slot level above 2nd.;Artificer;Artificer
2;Enlarge/Reduce;2nd level Transmutation;1 action;30 feet;V, S, M;Concentration, up to 1 minute;(a pinch of powdered iron)You cause a creature or an object you can see within range to grow larger or smaller for the duration. Choose either a creature or an object that is neither worn nor carried. If the target is unwilling, it can make a Constitution saving throw. On a success, the spell has no effect.<br> If the target is a creature, everything it is wearing and carrying changes size with it. Any item dropped by an affected creature returns to normal size at once.<br> <b>Enlarge</b>. The target's size doubles in all dimensions, and its weight is multiplied by eight. This growth increases its size by one category - from Medium to Large, for example. If there isn't enough room for the target to double its size, the creature or object attains the maximum possible size in the space available. Until the spell ends, the target also has advantage on Strength checks and Strength saving throws. The target's weapons also grow to match its new size. While these weapons are enlarged, the target's attack with them deal 1d4 extra damage.<br> <b>Reduce</b>. The target's size is halved in all dimensions, and its weight is reduced to one-eighth of normal. This reduction decreases its size by one category - from Medium to Small, for example. Until the spell ends, the target also has disadvantage on Strength checks and Strength saving throws. The target's weapons also shrink to match its new size. While these weapons are reduced, the target's attacks with them deal 1d4 less damage (this can't reduce the damage below 1). ;Artificer;Artificer
2;Heat Metal;2nd level Transmutation;1 action;60 feet;V, S, M;Concentration, up to 1 minute;(a piece of iron and a flame)Choose a manufactured metal object, such as a metal weapon or a suit of heavy or medium metal armor, that you can see within range. You cause the object to glow red-hot. Any creature in physical contact with the object takes 2d8 fire damage when you cast the spell. Until the spell ends, you can use a bonus action on each of your subsequent turns to cause this damage again.<br> If a creature is holding or wearing the object and takes the damage from it, the creature must succeed on a Constitution saving throw or drop the object if it can. If it doesn't drop the object, it has disadvantage on attack rolls and ability checks until the start of your next turn.<br> <b>At Higher Levels</b>: When you cast this spell using a spell slot of 3rd level or higher, the damage increases by 1d8 for each slot above 2nd. ;Artificer;Artificer
2;Invisibility;2nd level Illusion;1 action;Touch;V, S, M;Concentration, up to 1 hour;(an eyelash encased in gum arabic)A creature you touch becomes invisible until the spell ends. Anything the target is wearing or carrying is invisible as long as it is on the target's person. The spell ends for a target that attacks or casts a spell.<br> <b>At Higher Levels</b>: When you cast this spell using a spell slot of 3rd level or higher, you can target one additional creature for each slot level above 2nd. ;Artificer;Artificer
2;Lesser Restoration;2nd level Abjuration;1 action;Touch;V, S;Instantaneous;You touch a creature and can end either one disease or one condition afflicting it. The condition can be blinded, deafened, paralyzed, or poisoned.;Artificer;Artificer
2;Levitate;2nd level Transmutation;1 action;60 feet;V, S, M;Concentration, up to 10 minutes;(either a small leather loop or a piece of golden wire bent into a cup shape with a long shank on one end)One creature or object of your choice that you can see within range rises vertically, up to 20 feet, and remains suspended there for the duration. The spell can levitate a target that weighs up to 500 pounds. An unwilling creature that succeeds on a Constitution saving throw is unaffected.<br> The target can move only by pushing or pulling against a fixed object or surface within reach (such as a wall or a ceiling), which allows it to move as if it were climbing. You can change the target's altitude by up to 20 feet in either direction on your turn. If you are the target, you can move up or down as part of your move. Otherwise, you can use your action to move the target, which must remain within the spell's range.<br> When the spell ends, the target floats gently to the ground if it is still aloft. ;Artificer;Artificer
2;Magic Mouth (ritual);2nd level Illusion;1 minute;30 feet;V, S, M;Until dispelled;(a small bit of honeycomb and jade dust worth at least 10 gp, which the spell consumes)You implant a message within an object in range, a message that is uttered when a trigger condition is met. Choose an object that you can see and that isn't being worn or carried by another creature. Then speak the message, which must be 25 words or less, though it can be delivered over as long as 10 minutes. Finally, determine the circumstance that will trigger the spell to deliver your message.<br> When that circumstance occurs, a magical mouth appears on the object and recites the message in your voice and at the same volume you spoke. If the object you chose has a mouth or something that looks like a mouth (for example, the mouth of a statue), the magical mouth appears there so that words appear to come from the object's mouth. When you cast this spell, you can have the spell end after it delivers its message, or it can remain and repeats its message whenever the trigger occurs.<br> The triggering circumstance can be as general or as detailed as you like, though it must be based on visual or audible conditions that occur within 30 feet of the object. For example, you could instruct the mouth to speak when any creature moves within 30 feet of the object or when a silver bell rings within 30 feet of it. ;Artificer;Artificer
2;Magic Weapon;2nd level Transmutation;1 bonus action;Touch;V, S;Concentration, up to 1 hour;You touch a nonmagical weapon. Until the spell ends, that weapon becomes a magic weapon with a +1 bonus to attack rolls and damage rolls.<br> <b>At Higher Levels</b>: When you cast this spell using a spell slot of 4th level or higher, the bonus increases to +2. When you use a spell slot of 6th level or higher, the bonus increases to +3. ;Artificer;Artificer
2;Protection from Poison;2nd level Abjuration;1 action;Touch;V, S;1 hour;You touch a creature. If it is poisoned, you neutralize the poison. If more than one poison afflicts the target, you neutralize on poison that you know is present, or you neutralize one at random.<br> For the duration, the target has advantage on saving throws against being poisoned, and it has resistance to poison damage. ;Artificer;Artificer
2;Pyrotechnics;2nd level Transmutation;1 action;60 feet;V, S;Instantaneous;Choose an area of nonmagical flame that you can see and that can fit within a 5-foot cube within range. You can extinguish the fire in that area, and you create either fireworks or smoke when you do so.<br> <b>Fireworks</b>: The target explodes with a dazzling display of colors. Each creature within 10 feet of the target must succeed on a Constitution saving throw or become blinded until the end of your next turn.<br> <b>Smoke</b>: Thick black smoke spreads out from the target in a 20-foot radius, moving around corners. The area of the smoke is heavily obscured. The smoke persists for 1 minute or until a strong wind disperses it.;Artificer;Artificer
2;Rope Trick;2nd level Transmutation;1 action;Touch;V, S, M;1 hour;(powdered corn extract and a twisted loop of parchment)You touch a length of rope that is up to 60 feet long. One end of the rope then rises into the air until the whole rope hangs perpendicular to the ground. At the upper end of the rope, an invisible entrance opens to an extradimensional space that lasts until the spell ends.<br> The extradimensional space can be reached by climbing to the top of the rope. The space can hold as many as eight Medium or smaller creatures. The rope can be pulled into the space, making the rope disappear from view outside the space.<br> Attacks and spells can't cross through the entrance into or out of the extradimensional space, but those inside can see out of it as if through a 3-foot-by-5-foot window centered on the rope.<br> Anything inside the extradimensional space drops out when the spell ends. ;Artificer;Artificer
2;See Invisibility;2nd level Divination;1 action;Self;V, S, M;1 hour;(A pinch of Talc and a small sprinkling of powdered silver)For the duration, you see invisible creatures and objects as if they were visible, and you can see into the Ethereal Plane. Ethereal creatures and objects appear ghostly and translucent.;Artificer;Artificer
2;Skywrite (ritual);2nd level Transmutation;1 action;Sight;V, S;Concentration, up to 1 hour;You cause up to ten words to form in a part of the sky you can see. The words appear to be made of cloud and remain in place for the spell's duration. The words dissipate when the spell ends. A strong wind can disperse the clouds and end the spell early.;Artificer;Artificer
2;Spider Climb;2nd level Transmutation;1 action;Touch;V, S, M;Concentration, up to 1 hour;(a drop of bitumen and a spider)Until the spell ends, one willing creature you touch gains the ability to move up, down, and across vertical surfaces and upside down along ceilings, while leaving its hands free. The target also gains a climbing speed equal to its walking speed.;Artificer;Artificer
2;Web;2nd level Conjuration;1 action;60 feet;V, S, M;Concentration, up to 1 hour;(a bit of spider web)You conjure a mass of thick, sticky webbing at a point of your choice within range. The webs fill a 20-foot cube from that point for the duration. The webs are difficult terrain and lightly obscure their area.<br> If the webs aren't anchored between two solid masses (such as walls or trees) or layered across a floor, wall, or ceiling, the conjured web collapses on itself, and the spell ends at the start of your next turn. Webs layered over a flat surface have a depth of 5 feet.<br> Each creature that starts its turn in the webs or that enters them during its turn must make a Dexterity saving throw. On a failed save, the creature is restrained as long as it remains in the webs or until it breaks free.<br> A creature restrained by the webs can use its actions to make a Strength check against your spell save DC. If it succeeds, it is no longer restrained.<br> The webs are flammable. Any 5-foot cube of webs exposed to fire burns away in 1 round, dealing 2d4 fire damage to any creature that starts its turn in the fire. ;Artificer;Artificer
3;Blink;3rd level Transmutation;1 action;Self;V, S;1 minute;Roll a d20 at the end of each of your turns for the duration of the spell. On a roll of 11 or higher, you vanish from your current plane of existence and appear in the Ethereal Plane (the spell fails and the casting is wasted if you were already on that plane). At the start of you next turn, and when the spell ends if you are on the Ethereal Plane, you return to an unoccupied space of your choice that you can see within 10 feet of the space you vanished from. If no unoccupied space is available within that range, you appear in the nearest unoccupied space (chosen at random if more than one space is equally near). You can dismiss this spell as an action.<br> While on the Ethereal Plane, you can see and hear the plane you originated from, which is cast in shades of gray, and you can't see anything more than 60 feet away. You can only affect and be affected by other creatures on the Ethereal Plane. Creature that aren't there can't perceive you or interact with you, unless they have the ability to do so. ;Artificer;Artificer
3;Catnap;3rd level Enchantment;1 action;30 feet;S, M;10 minutes;(a pinch of sand)You make a calming gesture, and up to three willing creatures of your choice that you can see within range fall unconscious for the spell's duration. The spell ends on a target early if it takes damage or someone uses an action to shake or slap it awake. If a target remains unconscious for the full duration, that target gains the benefit of a short rest, and it can't be affected by this spell again until it finishes a long rest.<br> <b>At Higher Levels</b>: When you cast this spell using a spell slot of 4th level or higher, you can target one additional willing creature for each slot level above 3rd.;Artificer;Artificer
3;Create Food and Water;3rd level Conjuration;1 action;30 feet;V, S;Instantaneous;You create 45 pounds of food and 30 gallons of water on the ground or in containers within range, enough to sustain up to fifteen humanoids or five steeds for 24 hours. The food is bland but nourishing, and spoils if uneaten after 24 hours. The water is clean and doesn't go bad.;Artificer;Artificer
3;Crusader's Mantle;3rd level Evocation;1 action;Self;V;Concentration, up to 1 minute;Holy power radiates from you in an aura with a 30-foot radius, awakening boldness in friendly creatures. Until the spell ends, the aura moves with you, centered on you. While in the aura, each non-hostile creature in the aura (including you) deals an extra 1d4 radiant damage when it hits with a weapon attack.;Artificer;Artificer
3;Dispel Magic;3rd level Abjuration;1 action;120 feet;V, S;Instantaneous;Choose any creature, object, or magical effect within range. Any spell of 3rd level or lower on the target ends. For each spell of 4th level or higher on the target, make an ability check using your spellcasting ability. The DC equals 10 + the spell's level. On a successful check, the spell ends.<br> <b>At Higher Levels</b>: When you cast this spell using a spell slot of 4th level or higher, you automatically end the effects of a spell on the target if the spell's level is equal to or less than the level of the spell slot you used. ;Artificer;Artificer
3;Elemental Weapon;3rd level Transmutation;1 action;Touch;V, S;Concentration, up to 1 hour;A nonmagical weapon you touch becomes a magic weapon. Choose one of the following damage types - acid, cold, fire, lightning, or thunder. For the duration, the weapon has a +1 bonus to attack rolls and deals an extra 1d4 damage of the chosen type when it hits.<br> <b>At Higher Levels</b>: When you cast this spell using a spell slot of 5th or 6th level, the bonus to attack rolls increases to +2 and the extra damage increases to 2d4. When you use a spell slot of 7th level or higher, the bonus increases to +3 and the extra damage increases to 3d4. ;Artificer;Artificer
3;Flame Arrows;3rd level Transmutation;1 action;Touch;V, S;Concentration, up to 1 hour;You touch a quiver containing arrows or bolts. When a target is hit by a ranged weapon attack using a piece of ammunition drawn from the quiver, the target takes an extra 1d6 fire damage. The spell's magic ends on the piece of ammunition when it hits or misses, and the spell ends when twelve pieces of ammunition have been drawn from the quiver.<br> <b>At Higher Levels</b>: When you cast this spell using a spell slot of 4th level or higher, the number of pieces of ammunition you can affect with this spell increases by two for each slot level above 3rd.;Artificer;Artificer
3;Fly;3rd level Transmutation;1 action;Touch;V, S, M;Concentration, up to 10 minutes;(a wing feather from any bird)You touch a willing creature. The target gains a flying speed of 60 feet for the duration. When the spell ends, the target falls if it is still aloft, unless it can stop the fall.<br> <b>At Higher Levels</b>: When you cast this spell using a spell slot of 4th level or higher, you can target one additional creature for each slot level above 3rd. ;Artificer;Artificer
3;Glyph of Warding;3rd level Abjuration;1 hour;Touch;V, S, M;Until dispelled or triggered;(incense and powdered diamond worth at least 200 gp, which the spell consumes)When you cast this spell, you inscribe a glyph that harms other creatures, either upon a surface (such as a table or a section of floor or wall) or within an object that can be closed (such as a book, a scroll, or a treasure chest) to conceal the glyph. If you choose a surface, the glyph can cover an area of the surface no larger than 10 feet in diameter. If you choose an object, that object must remain in its place, if the object is moved more than 10 feet from where you cast this spell, the glyph is broken and the spell ends without being triggered.<br> The glyph is nearly invisible and requires a successful Intelligence (Investigation) check against your spell save DC to be found.<br> You decide what triggers the glyph when you cast the spell. For glyphs inscribed on a surface, the most typical triggers include touching or standing on the glyph, removing another object covering the glyph, approaching within a certain distance of the glyph, or manipulating the object on which the glyph is inscribed. For glyphs inscribed within an object, the most common triggers include opening that object, approaching within a certain distance of the object, or seeing or reading the glyph. Once a glyph is triggered, this spell ends.<br> You can further refine the trigger so the spell activates only under certain circumstances or according to physical characteristics (such as height or weight), creature kind (for example, the ward could be set to affect aberrations or drow), or alignment. You can also set conditions for creatures that don't trigger the glyph, such as those who say a certain password.<br> When you inscribe the glyph, choose explosive runes or a spell glyph.<br> <b>Explosive Runes</b>: When triggered, the glyph erupts with magical energy in a 20-foot-radius sphere centered on the glyph. The sphere spreads around corners. Each creature in the aura must make a Dexterity saving throw. A creature takes 5d8 acid, cold, fire, lightning, or thunder damage on a failed saving throw (your choice when you create the glyph), or half as much damage on a successful one.<br> <b>Spell Glyph</b>: You can store a prepared spell of or lower in the glyph by casting it as part of creating the glyph. The spell must target a single creature or an area. The spell being stored has no immediate effect when cast in this way. When the glyph is triggered, the stored spell is cast. If the spell has a target, it targets the creature that triggered the glyph. If the spell affects an area, the area is centered on that creature. If the spell summons hostile creatures or creates harmful objects or traps, they appear as close as possible to the intruder and attack it. If the spell requires concentration, it lasts until the end of its full duration.<br> <b>At Higher Levels</b>: When you cast this spell using a spell slot of 4th level or higher, the damage of an explosive runes glyph increases by 1d8 for each slot level above 3rd. If you create a <i>spell glyph</i>, you can store any spell of up to the same level as the slot you use for the <i>glyph of warding</i>. ;Artificer;Artificer
3;Haste;3rd level Transmutation;1 action;30 feet;V, S, M;Concentration, up to 1 minute;(a shaving of licorice root)Choose a willing creature that you can see within range. Until the spell ends, the target's speed is doubled, it gains a +2 bonus to AC, it has advantage on Dexterity saving throws, and it gains an additional action on each of its turns. That action can be used only to take the Attack (one weapon attack only), Dash, Disengage, Hide, or Use an Object action.<br> When the spell ends, the target can't move or take actions until after its next turn, as a wave of lethargy sweeps over it. ;Artificer;Artificer
3;Intellect Fortress;3rd-level abjuration;1 action;30 feet;V;Concentration, up to 1 hour;For the duration, you or one willing creature you can see within range has resistance to psychic damage, as well as advantage on Intelligence, Wisdom, and Charisma saving throws.<br><b>At Higher Levels</b>: When you cast this spell using a spell slot of 4th level or higher, you can target one additional creature for each slot level above 3rd. The creatures must be within 30 feet of each other when you target them.;Artificer (TCE);Artificer
3;Protection from Energy;3rd level Abjuration;1 action;Touch;V, S;Concentration, up to 1 hour;For the duration, the willing creature you touch has resistance to one damage type of your choice: acid, cold, fire, lightning, or thunder.;Artificer;Artificer
3;Revivify;3rd level Necromancy;1 action;Touch;V, S, M;Instantaneous;(diamonds worth 300 gp, which the spell consumes)You touch a creature that has died within the last minute. That creature returns to life with 1 hit point. This spell can't return to life a creature that has died of old age, nor can it restore any missing body parts.;Artificer;Artificer
3;Tiny Servant;3rd level Transmutation;1 minute;Touch;V, S;8 hours;You touch one Tiny, nonmagical object that isn't attached to another object or a surface and isn't being carried by another creature. The target animates and sprouts little arms and legs, becoming a creature under your control until the spell ends or the creature drops to 0 hit points. See the stat block (XGE p169) for its statistics.<br> As a bonus action, you can mentally command the creature if it is within 120 feet of you. (If you control multiple creatures with this spell, you can command any or all of them at the same time, issuing the same command to each one.) You decide what action the creature will take and where it will move during its next turn, or you can issue a simple, general command, such as to fetch a key, stand watch, or stack some books. If you issue no commands, the servant does nothing other than defend itself against hostile creatures. Once given an order, the servant continues to follow that order until its task is complete.<br> When the creature drops to 0 hit points, it reverts to its original form, and any remaining damage carries over to that form.<br> <b>At Higher Levels</b>: When you cast this spell using a spell slot of 4th level or higher, you can animate two additional objects for each slot level above 3rd.;Artificer;Artificer
3;Water Breathing (ritual);3rd level Transmutation;1 action;30 feet;V, S, M;24 hours;(a short reed or piece of straw)This spell grants up to ten willing creatures you can see within range the ability to breathe underwater until the spell ends. Affected creatures also retain their normal mode of respiration.;Artificer;Artificer
3;Water Walk (ritual);3rd level Transmutation;1 action;30 feet;V, S, M;1 hour;(a piece of cork)This spell grants the ability to move across any liquid surface - such as water, acid, mud, snow, quicksand, or lava - as if it were harmless solid ground (creatures crossing molten lava can still take damage from the heat). Up to ten willing creatures you can see within range gain this ability for the duration.<br> If your target a creature submerged in a liquid, the spell carries the target to the surface of the liquid at a rate of 60 feet per round. ;Artificer;Artificer
4;Arcane Eye;4th level Divination;1 action;30 feet;V, S, M;Concentration, up to 1 hour;(a bit of bat fur)You create an invisible, magical eye within range that hovers in the air for the duration.<br> You mentally receive visual information from the eye, which has normal vision and darkvision out to 30 feet. The eye can look in every direction.<br> As an action, you can move the eye up to 30 feet in any direction. There is no limit to how far away from you the eye can move, but it can't enter another plane of existence. A solid barrier blocks the eye's movement, but the eye can pass through an opening as small as 1 inch in diameter. ;Artificer;Artificer
