4;Banishment;4th level Abjuration;1 action;60 feet;V, S, M;Concentration, up to 1 minute;(an item distasteful to the target)You attempt to send one creature that you can see within range to another place of existence. The target must succeed on a Charisma saving throw or be banished.<br> If the target is native to the plane of existence you're on, you banish the target to a harmless demiplane. While there, the target is incapacitated. The target remains there until the spell ends, at which point the target reappears in the space it left or in the nearest unoccupied space if that space is occupied.<br> If the target is native to a different plane of existence that the one you're on, the target is banished with a faint popping noise, returning to its home plane. If the spell ends before 1 minute has passed, the target reappears in the space it left or in the nearest unoccupied space if that space is occupied. Otherwise, the target doesn't return.<br> <b>At Higher Levels</b>: When you cast this spell using a spell slot of 5th level or higher, you can target one additional creature for each slot level above 4th. ;Paladin (*)(Vengeance)(Crown);Paladin
4;Death Ward;4th level Abjuration;1 action;Touch;V, S;8 hours;You touch a creature and grant it a measure of protection from death.<br> The first time the target would drop to 0 hit points as a result of taking damage, the target instead drops to 1 hit point, and the spell ends.<br> If the spell is still in effect when the target is subjected to an effect that would kill it instantaneously without dealing damage, that effect is instead negated against the target, and the spells ends.;Paladin;Paladin
4;Find Greater Steed;4th level Conjuration;10 minutes;30 feet;V, S;Instantaneous;You summon a spirit that assumes the form of a loyal, majestic mount. Appearing in an unoccupied space within range, the spirit takes on a form you choose: a griffon, a pegasus, a peryton , a dire wolf, a rhinoceros, or a saber-toothed tiger. The creature has the statistics provided in the <i>Monster Manual</i> for the chosen form, though it is a celestial, a fey, or a fiend (your choice) instead of its normal creature type. Additionally, if it has an Intelligence score of 5 or lower, its Intelligence becomes 6, and it gains the ability to understand one language of your choice that you speak.<br> You control the mount in combat. While the mount is within 1 mile of you, you can communicate with it telepathically. While mounted on it, you can make any spell you cast that targets only you also target the mount.<br> The mount disappears temporarily when it drops to 0 hit points or when you dismiss it as an action. Casting this spell again re-summons the bonded mount, with all its hit points restored and any conditions removed.<br> You can't have more than one mount bonded by this spell or <i>find steed</i> at the same time. As an action, you can release a mount from its bond, causing it to disappear permanently.<br> Whenever the mount disappears, it leaves behind any objects it was wearing or carrying.;Paladin (XGE);Paladin
4;Locate Creature;4th level Divination;1 action;Self;V, S, M;Concentration, up to 1 hour;(a bit of fur from a bloodhound)Describe or name a creature that is familiar to you. You sense the direction to the creature's location, as long as that creature is within 1,000 feet of you. If the creature is moving, you know the direction of its movement.<br> The spell can locate a specific creature known to you, or the nearest creature of a specific kind (such as a human or a unicorn), so long as you have seen such a creature up close - within 30 feet - at least once. If the creature you described or named is in a different form, such as being under the effects of a <i>polymorph</i> spell, this spell doesn't locate the creature.<br> This spell can't locate a creature if running water at least 10 feet wide blocks a direct path between you and the creature. ;Paladin;Paladin
4;Staggering Smite;4th level Evocation;1 bonus action;Self;V;Concentration, up to 1 minute;The next time you hit a creature with a melee weapon attack during this spell's duration, your weapon pierces both body and mind, and the attack deals an extra 4d6 psychic damage to the target. The target must make a Wisdom saving throw. On a failed save, it has disadvantage on attack rolls and ability checks, and can't take reactions, until the end of its next turn.;Paladin;Paladin
4;Stoneskin;4th level Abjuration;1 action;Touch;V, S, M;Concentration, up to 1 hour;(diamond dust worth 100 gp, which the spell consumes)This spell turns the flesh of a willing creature you touch as hard as stone. Until the spell ends, the target has resistance to nonmagical bludgeoning, piercing, and slashing damage.;Paladin;Paladin
5;Banishing Smite;5th level Abjuration;1 bonus action;Self;V;Concentration, up to 1 minute;The next time you hit a creature with a weapon attack before this spell ends, your weapon crackles with force, and the attack deals an extra 5d10 force damage to the target. Additionally, if this attack reduces the target to 50 hit points of fewer, you banish it. If the target is native to a different plane of existence than the one you're on, the target disappears, returning to its home plane. If the target is native to the plane you're on, the creature vanishes into a harmless demiplane. While there, the target is incapacitated. It remains there until the spell ends, at which point the target reappears in the space it left or in the nearest unoccupied space if that space is occupied.;Paladin;Paladin
5;Circle of Power;5th level Abjuration;1 action;Self (30-foot radius);V;Concentration, up to 10 minutes;Divine energy radiates from you, distorting and diffusing magical energy within 30 feet of you. Until the spell ends, the sphere moves with you, centered on you. For the duration, each friendly creature in the area (including you) has advantage on saving throws against spells and other magical effects. Additionally, when an affected creature succeeds on a saving throw made against a spell or magical effect that allows it to make a saving throw to take only half damage, it instead takes no damage if it succeeds on the saving throw.;Paladin (*)(Crown);Paladin
5;Destructive Wave;5th level Evocation;1 action;Self (30-foot radius);V;Instantaneous;You strike the ground, creating a burst of divine energy that ripples outward from you. Each creature you choose within 30 feet of you must succeed on a Constitution saving throw or take 5d6 thunder damage, as well as 5d6 radiant or necrotic damage (your choice), and be knocked prone. A creature that succeeds on its saving throw takes half as much damage and isn't knocked prone.;Paladin;Paladin
5;Dispel Evil and Good;5th level Abjuration;1 action;Self;V, S, M;Concentration, up to 1 minute;(holy water or powdered silver and iron)Shimmering energy surrounds and protects you from fey, undead, and creatures originating from beyond the Material Plane. For the duration, celestials, elementals, fey, fiends, and undead have disadvantage on attack rolls against you.<br> You can end the spell early by using either of the following special functions.<br> <b>Break Enchantment</b>: As your action, you touch a creature you can reach that is charmed, frightened, or possessed by a celestial, an elemental, a fey, a fiend, or an undead. The creature you touch is no longer charmed, frightened, or possessed by such creatures.<br> <b>Dismissal</b>: As your action, make a melee spell attack against a celestial, an elemental, a fey, a fiend, or an undead you can reach. On a hit, you attempt to drive the creature back to its home plane. The creature must succeed on a Charisma saving throw or be sent back to its home plane (if it isn't there already). If they aren't on their home plane, undead are sent to the Shadowfell, and fey are sent to the Feywild. ;Paladin;Paladin
5;Geas;5th level Enchantment ;1 minute;60 feet;V;30 days;You place a magical command on a creature that you can see within range, forcing it to carry out some service or refrain from some action or course of activity as you decide. If the creature can understand you, it must succeed on a Wisdom saving throw or become charmed by you for the duration. While the creature is charmed by you, it takes 5d10 psychic damage each time it acts in a manner directly counter to your instructions, but no more than once each day. A creature that can't understand you is unaffected by the spell.<br> You can issue any command you choose, short of an activity that would result in certain death. Should you issue a suicidal command, the spell ends.<br> You can end the spell early by using an action to dismiss it. A <i>remove curse</i>, <i>greater restoration</i>, or <i>wish</i> spell also ends it.<br> <b>At Higher Levels</b>: When you cast this spell using a spell slot of 7th or 8th level, the duration is 1 year. When you cast this spell using a spell slot of the spell lasts until it is ended by one of the spells mentioned above. ;Paladin (*)(Crown);Paladin
5;Holy Weapon;5th level Evocation;1 bonus action;Touch;V, S;Concentration, up to 1 hour;You imbue a weapon you touch with holy power. Until the spell ends, the weapon emits bright light in a 30-foot radius and dim light for an additional 30 feet. In addition, weapon attacks made with it deal an extra 2d8 radiant damage on a hit. If the weapon isn't already a magic weapon, it becomes one for the duration.<br> As a bonus action on your turn, you can dismiss this spell and cause the weapon to emit a burst of radiance. Each creature of your choice that you can see within 30 feet of you must make a Constitution saving throw. On a failed save, a creature takes 4d8 radiant damage, and it is blinded for 1 minute. On a successful save, a creature takes half as much damage and isn't blinded. At the end of each of its turns, a blinded creature can make a Constitution saving throw, ending the effect on itself on a success.;Paladin (XGE);Paladin
5;Raise Dead;5th level Necromancy;1 hour;Touch;V, S, M;Instantaneous;(a diamond worth at least 500 gp, which the spell consumes)You return a dead creature you touch to life, provided that it has been dead no longer than 10 days. If the creature's soul is both willing and at liberty to rejoin the body, the creature returns to life with 1 hit point.<br> This spell also neutralizes any poison and cures nonmagical diseases that affected the creature at the time it died. This spell doesn't, however, remove magical diseases, curses, or similar effects, if these aren't first removed prior to casting the spell, they take effect when the creature returns to life. The spell can't return an undead creature to life.<br> This spell closes all mortal wounds, but it doesn't restore missing body parts. If the creature is lacking body parts or organs integral for its survival - its head, for instance - the spell automatically fails.<br> Coming back from the dead is an ordeal. The target takes a -4 penalty to all attack rolls, saving throws, and ability checks. Every time the target finishes a long rest, the penalty is reduced by 1 until it disappears. ;Paladin;Paladin
5;Summon Celestial;5th-level conjuration;1 action;90 feet;V, S, M;Concentration, up to 1 hour;(a golden reliquary worth at least 500 gp)You call forth a celestial spirit. It manifests in an angelic form in an unoccupied space that you can see within range. This corporeal form uses the Celestial Spirit stat block. When you cast the spell, choose Avenger or Defender. Your choice determines the creature's attack in its stat block. The creature disappears when it drops to 0 hit points or when the spell ends.<br>The creature is an ally to you and your companions. In combat, the creature shares your initiative count, but it takes its turn immediately after yours. It obeys your verbal commands (no action required by you). If you don't issue any, it takes the Dodge action and uses its move to avoid danger.<br><b>At Higher Levels</b>: When you cast this spell using a spell slot of 6th level or higher, use the higher level whenever the spell's level appears in the stat block.;Paladin (TCE);Paladin
